{
  "schema_version": 1,
  "global_sources": [
    "AGENTS.md",
    "docs/engineering/current-only-documentation-policy.md",
    "docs/engineering/repository-change-workflow.md",
    "README.md",
    "docs/architecture/SOURCES.md",
    "docs/adr/decision-register.md",
    "docs/architecture/implementation-status.md",
    "docs/architecture/APPLICATION-IMPLEMENTATION-ROADMAP.md",
    "docs/architecture/ENGINEERING-HARDENING-ROADMAP.md"
  ],
  "full_read_triggers": [
    {
      "id": "bounded-context-boundary",
      "description": "Changing or creating a bounded context, independent deployable, or service boundary requires full architecture review.",
      "match_terms": ["new service", "service boundary", "bounded context", "microservice", "سرویس جدید", "مرز سرویس", "باندد کانتکست"]
    },
    {
      "id": "security-authority",
      "description": "Changing authentication, Authorization, MFA, tenant authority, trust, quota authority, secret authority, or admission architecture requires full review.",
      "match_terms": ["security authority", "authentication architecture", "authorization architecture", "mfa policy", "tenant authority", "trust boundary", "secret authority", "admission architecture", "معماری امنیت", "مرز اعتماد", "مرجع مجوز"]
    },
    {
      "id": "persistence-consistency-recovery",
      "description": "Changing persistence ownership, consistency, durability, backup, restore, or recovery semantics requires full review.",
      "match_terms": ["persistence architecture", "consistency model", "durability model", "recovery semantics", "backup architecture", "restore architecture", "معماری دیتابیس", "مدل سازگاری", "بازیابی"]
    },
    {
      "id": "platform-topology-technology",
      "description": "Introducing, removing, or replacing platform topology, a control plane, or architecture-sensitive platform technology requires full review.",
      "match_terms": ["platform topology", "new platform technology", "replace platform", "control plane", "new datastore", "new broker", "معماری پلتفرم", "تکنولوژی جدید پلتفرم", "کنترل پلین"]
    },
    {
      "id": "broad-or-uncertain",
      "description": "Broad, cross-cutting, conflicting, or uncertain current-source scope requires full review.",
      "match_terms": ["whole system", "entire architecture", "cross cutting", "cross-cutting", "all services", "کل سیستم", "کل معماری", "همه سرویس ها", "همه سرویس‌ها"]
    },
    {
      "id": "privileged-agent-operations",
      "description": "Changing AI/agent local write, process execution, administrator authority, interactive desktop input/capture, or privileged MCP trust boundaries requires full architecture and security review.",
      "match_terms": ["ops mcp", "privileged agent", "admin mcp", "administrator mcp", "process.run", "filesystem.write_text", "agent execution", "agent write access", "desktop mcp", "computer use", "mouse automation", "keyboard automation", "screen capture", "gui automation", "کنترل دسکتاپ", "ماوس", "کیبورد", "دسترسی ادمین ایجنت", "اجرای دستور توسط ایجنت"]
    }
  ],
  "routes": [
    {
      "id": "identity",
      "title": "Identity/password/MFA/session/tenant",
      "review_mode": "targeted",
      "match_terms": ["identity", "password", "credential", "mfa", "totp", "session", "tenant membership", "احراز هویت", "رمز عبور", "نشست", "عضویت مستاجر"],
      "minimum_sources": [
        "docs/architecture/services/identity-service.md",
        "docs/adr/0012-define-identity-tenant-session-external-and-mfa-v1.md",
        "docs/adr/0023-define-identity-jwt-signing-key-lifecycle-v1.md",
        "docs/architecture/security-architecture.md",
        "docs/architecture/testing-and-quality-gates.md",
        "docs/architecture/PRODUCTION-READINESS-CHECKLIST.md"
      ],
      "summary": "Add ADR-0024 when quota changes and ADR-0040 when compromised-password behavior changes."
    },
    {
      "id": "compromised-password",
      "title": "Compromised Password source/dataset/runtime",
      "review_mode": "targeted",
      "match_terms": ["compromised password", "hibp", "pwned password", "sqlite dataset", "sha-1 corpus", "رمز افشا شده", "دیتاست hibp"],
      "minimum_sources": [
        "docs/adr/0040-define-self-contained-compromised-password-sqlite-v1.md",
        "docs/architecture/services/compromised-password-service.md",
        "docs/architecture/services/identity-service.md",
        "docs/architecture/data-and-messaging.md",
        "docs/technology/technology-baseline.md",
        "docs/technology/production-compatibility-matrix.md",
        "docs/engineering/build-and-ci-quality-enforcement.md",
        "docs/architecture/testing-and-quality-gates.md",
        "docs/architecture/security-architecture.md",
        "docs/architecture/PRODUCTION-READINESS-CHECKLIST.md"
      ],
      "summary": "Review source/provenance, immutable SQLite format, runtime fail-closed behavior, Identity comparison, and release evidence together."
    },
    {
      "id": "semantic-quota",
      "title": "Semantic quota/Redis/time/network abuse",
      "review_mode": "targeted",
      "match_terms": ["semantic quota", "quota", "redis quota", "clock safety", "rate limit", "client_ip_exact", "سهمیه", "ریت لیمیت", "ردیس"],
      "minimum_sources": [
        "docs/adr/0024-harden-semantic-quota-time-safety-v1.md",
        "docs/adr/0043-define-production-network-trust-boundaries-v1.md",
        "docs/architecture/services/identity-service.md",
        "docs/architecture/services/web-bff.md",
        "docs/architecture/data-and-messaging.md",
        "docs/architecture/reliability-and-observability.md",
        "docs/architecture/performance-and-bottlenecks.md",
        "docs/architecture/security-architecture.md",
        "docs/architecture/testing-and-quality-gates.md",
        "docs/operations/chaos-engineering-program.md",
        "docs/architecture/PRODUCTION-READINESS-CHECKLIST.md"
      ],
      "summary": "If a synchronous dependency edge changes, also review the canonical dependency registry."
    },
    {
      "id": "public-edge-client-address",
      "title": "Public client address/proxy/WAF",
      "review_mode": "targeted",
      "match_terms": ["client address", "client ip", "proxy protocol", "traefik", "waf", "coraza", "caddy", "forwarded header", "آی پی کاربر", "پروکسی", "واف"],
      "minimum_sources": [
        "docs/adr/0001-select-dedicated-caddy-coraza-edge-waf.md",
        "docs/adr/0043-define-production-network-trust-boundaries-v1.md",
        "docs/architecture/network-architecture.md",
        "docs/architecture/services/web-bff.md",
        "docs/adr/0024-harden-semantic-quota-time-safety-v1.md",
        "docs/architecture/security-architecture.md",
        "docs/architecture/testing-and-quality-gates.md",
        "docs/architecture/PRODUCTION-READINESS-CHECKLIST.md",
        "docs/runbooks/local-traefik-edge.md",
        "docs/technology/production-compatibility-matrix.md"
      ],
      "summary": "Preserve external-L4 -> Traefik -> WAF trust, exact API-BFF/static-frontend route split, and forged-header/direct-workload negative tests."
    },
    {
      "id": "authorization",
      "title": "Authorization",
      "review_mode": "targeted",
      "match_terms": ["authorization", "checkpermission", "permission", "role", "owner safety", "مجوز", "نقش", "دسترسی"],
      "minimum_sources": [
        "docs/architecture/services/authorization-service.md",
        "docs/adr/0013-use-online-authorization-without-cache-or-kafka-v1.md",
        "docs/adr/0026-harden-online-authorization-overload-and-slo-v1.md",
        "docs/adr/0032-finalize-authorization-slo-alerting-and-breaker-recovery-v1.md",
        "docs/adr/0036-refine-authorization-breaker-recovery-and-dependency-policy-governance-v1.md",
        "docs/architecture/dependency-criticality.yaml",
        "docs/architecture/security-architecture.md",
        "docs/architecture/testing-and-quality-gates.md",
        "docs/architecture/performance-and-bottlenecks.md",
        "docs/architecture/PRODUCTION-READINESS-CHECKLIST.md"
      ],
      "summary": "Keep one online fail-closed permission authority with no permission cache/retry/stale allow."
    },
    {
      "id": "notification",
      "title": "Notification",
      "review_mode": "targeted",
      "match_terms": ["notification", "email", "smtp", "gmail", "google smtp", "sms", "sms.ir", "smsir", "template", "delivery", "اعلان", "ایمیل", "پیامک"],
      "minimum_sources": [
        "docs/architecture/services/notification-service.md",
        "docs/adr/0006-finalize-notification-v1-handoff-and-semantic-contract.md",
        "docs/adr/0007-define-notification-v1-runtime.md",
        "docs/adr/0010-use-versioned-database-notification-templates-and-liara-email.md",
        "docs/adr/0055-use-provider-neutral-smtp-with-google-gmail-staging-v1.md",
        "docs/adr/0014-use-local-notification-delivery-key-ring-in-v1.md",
        "docs/adr/0018-simplify-notification-clock-safety-and-remove-dispatch-fence-v1.md",
        "docs/adr/0056-select-smsir-exact-text-sms-and-sandbox-validation-v1.md",
        "docs/architecture/data-and-messaging.md",
        "docs/architecture/testing-and-quality-gates.md",
        "docs/runbooks/production-cold-dr.md"
      ],
      "summary": "Preserve durable handoff, ambiguity/reconciliation, exact accepted content, and provider evidence semantics."
    },
    {
      "id": "reference-data",
      "title": "Reference Data capability/bundle/service trigger",
      "review_mode": "targeted",
      "match_terms": ["reference data", "country data", "currency data", "timezone", "supported locale", "داده مرجع", "کشور", "ارز", "منطقه زمانی"],
      "minimum_sources": [
        "docs/adr/0041-define-reference-data-service-v1.md",
        "docs/architecture/services/reference-data-service.md",
        "docs/architecture/services/web-bff.md",
        "docs/architecture/data-and-messaging.md",
        "docs/architecture/implementation-status.md",